04:03:54.858057 IP ip-172-31-72-201.ec2.internal.ssh > ec2-35-172-155-192.compute-1.amazonaws.com.59244: Flags [P.], seq 1921404134:1921404178, ack 4052534753, win 6376, options [nop,nop,TS val 3038159188 ecr 3504497064], length 44
04:03:54.859555 IP ip-172-31-72-201.ec2.internal.ssh > ec2-35-172-155-192.compute-1.amazonaws.com.59244: Flags [P.], seq 44:248, ack 1, win 6376, options [nop,nop,TS val 3038159190 ecr 3504497064], length 204
04:03:54.859988 IP ip-172-31-72-201.ec2.internal.51163 > ip-172-31-0-2.ec2.internal.domain: 37895+ PTR? 192.155.172.35.in-addr.arpa. (45)
04:03:54.860471 IP ec2-35-172-155-192.compute-1.amazonaws.com.59244 > ip-172-31-72-201.ec2.internal.ssh: Flags [.], ack 44, win 2523, options [nop,nop,TS val 3504497154 ecr 3038159188], length 0
04:03:54.860979 IP ec2-35-172-155-192.compute-1.amazonaws.com.59244 > ip-172-31-72-201.ec2.internal.ssh: Flags [.], ack 248, win 2522, options [nop,nop,TS val 3504497154 ecr 3038159190], length 0
04:03:54.862939 IP ip-172-31-0-2.ec2.internal.domain > ip-172-31-72-201.ec2.internal.51163: 37895 1/0/0 PTR ec2-35-172-155-192.compute-1.amazonaws.com. (101)
04:03:54.863069 IP ip-172-31-72-201.ec2.internal.47551 > ip-172-31-0-2.ec2.internal.domain: 1533+ PTR? 201.72.31.172.in-addr.arpa. (44)
04:03:54.866056 IP ip-172-31-0-2.ec2.internal.domain > ip-172-31-72-201.ec2.internal.47551: 1533 1/0/0 PTR ip-172-31-72-201.ec2.internal. (87)
04:03:54.866228 IP ip-172-31-72-201.ec2.internal.58901 > ip-172-31-0-2.ec2.internal.domain: 38977+ PTR? 2.0.31.172.in-addr.arpa. (41)
04:03:54.868280 IP ip-172-31-0-2.ec2.internal.domain > ip-172-31-72-201.ec2.internal.58901: 38977 1/0/0 PTR ip-172-31-0-2.ec2.internal. (81)
04:03:55.119605 IP ip-172-31-72-201.ec2.internal.ssh > ec2-35-172-155-192.compute-1.amazonaws.com.59244: Flags [P.], seq 248:756, ack 1, win 6376, options [nop,nop,TS val 3038159450 ecr 3504497154], length 508
04:03:55.125191 IP ec2-35-172-155-192.compute-1.amazonaws.com.59244 > ip-172-31-72-201.ec2.internal.ssh: Flags [.], ack 756, win 2519, options [nop,nop,TS val 3504497419 ecr 3038159450], length 0
04:03:55.458011 IP ec2-35-172-155-192.compute-1.amazonaws.com.59244 > ip-172-31-72-201.ec2.internal.ssh: Flags [P.], seq 1:101, ack 756, win 2523, options [nop,nop,TS val 3504497751 ecr 3038159450], length 100
04:03:55.458692 IP ip-172-31-72-201.ec2.internal.ssh > ec2-35-172-155-192.compute-1.amazonaws.com.59244: Flags [P.], seq 756:1000, ack 101, win 6376, options [nop,nop,TS val 3038159789 ecr 3504497751], length 244
04:03:55.459681 IP ec2-35-172-155-192.compute-1.amazonaws.com.59244 > ip-172-31-72-201.ec2.internal.ssh: Flags [.], ack 1000, win 2522, options [nop,nop,TS val 3504497753 ecr 3038159789], length 0
04:03:56.507605 IP ec2-35-172-155-192.compute-1.amazonaws.com.59244 > ip-172-31-72-201.ec2.internal.ssh: Flags [P.], seq 101:201, ack 1000, win 2523, options [nop,nop,TS val 3504498799 ecr 3038159789], length 100
04:03:56.508276 IP ip-172-31-72-201.ec2.internal.ssh > ec2-35-172-155-192.compute-1.amazonaws.com.59244: Flags [P.], seq 1000:1244, ack 201, win 6376, options [nop,nop,TS val 3038160838 ecr 3504498799], length 244
04:03:56.516695 IP ec2-35-172-155-192.compute-1.amazonaws.com.59244 > ip-172-31-72-201.ec2.internal.ssh: Flags [.], ack 1244, win 2522, options [nop,nop,TS val 3504498810 ecr 3038160838], length 0
04:03:56.713714 IP ec2-35-172-155-192.compute-1.amazonaws.com.59244 > ip-172-31-72-201.ec2.internal.ssh: Flags [P.], seq 201:285, ack 1244, win 2523, options [nop,nop,TS val 3504499007 ecr 3038160838], length 84
04:03:56.714198 IP ip-172-31-72-201.ec2.internal.ssh > ec2-35-172-155-192.compute-1.amazonaws.com.59244: Flags [P.], seq 1244:1312, ack 285, win 6376, options [nop,nop,TS val 3038161044 ecr 3504499007], length 68
04:03:56.717094 IP ec2-35-172-155-192.compute-1.amazonaws.com.59244 > ip-172-31-72-201.ec2.internal.ssh: Flags [.], ack 1312, win 2523, options [nop,nop,TS val 3504499010 ecr 3038161044], length 0
04:03:57.563406 IP ec2-35-172-155-192.compute-1.amazonaws.com.59244 > ip-172-31-72-201.ec2.internal.ssh: Flags [P.], seq 285:385, ack 1312, win 2523, options [nop,nop,TS val 3504499857 ecr 3038161044], length 100
04:03:57.564172 IP ip-172-31-72-201.ec2.internal.ssh > ec2-35-172-155-192.compute-1.amazonaws.com.59244: Flags [P.], seq 1312:1556, ack 385, win 6376, options [nop,nop,TS val 3038161894 ecr 3504499857], length 244
04:03:57.570988 IP ec2-35-172-155-192.compute-1.amazonaws.com.59244 > ip-172-31-72-201.ec2.internal.ssh: Flags [.], ack 1556, win 2522, options [nop,nop,TS val 3504499864 ecr 3038161894], length 0
04:03:57.915919 IP ip-172-31-72-201.ec2.internal.ssh > ec2-35-172-155-192.compute-1.amazonaws.com.59244: Flags [P.], seq 1556:2064, ack 385, win 6376, options [nop,nop,TS val 3038162246 ecr 3504499864], length 508
04:03:57.919126 IP ec2-35-172-155-192.compute-1.amazonaws.com.59244 > ip-172-31-72-201.ec2.internal.ssh: Flags [.], ack 2064, win 2519, options [nop,nop,TS val 3504500212 ecr 3038162246], length 0
04:03:58.613533 IP ec2-35-172-155-192.compute-1.amazonaws.com.59244 > ip-172-31-72-201.ec2.internal.ssh: Flags [P.], seq 385:485, ack 2064, win 2523, options [nop,nop,TS val 3504500907 ecr 3038162246], length 100
04:03:58.614179 IP ip-172-31-72-201.ec2.internal.ssh > ec2-35-172-155-192.compute-1.amazonaws.com.59244: Flags [P.], seq 2064:2308, ack 485, win 6376, options [nop,nop,TS val 3038162944 ecr 3504500907], length 244
04:03:58.616304 IP ec2-35-172-155-192.compute-1.amazonaws.com.59244 > ip-172-31-72-201.ec2.internal.ssh: Flags [.], ack 2308, win 2522, options [nop,nop,TS val 3504500910 ecr 3038162944], length 0
04:03:58.859702 IP ip-172-31-72-201.ec2.internal.ssh > ec2-35-172-155-192.compute-1.amazonaws.com.59244: Flags [P.], seq 2308:2400, ack 485, win 6376, options [nop,nop,TS val 3038163190 ecr 3504500910], length 92
04:03:58.863803 IP ec2-35-172-155-192.compute-1.amazonaws.com.59244 > ip-172-31-72-201.ec2.internal.ssh: Flags [.], ack 2400, win 2523, options [nop,nop,TS val 3504501157 ecr 3038163190], length 0
04:03:58.965557 IP ec2-35-172-155-192.compute-1.amazonaws.com.59244 > ip-172-31-72-201.ec2.internal.ssh: Flags [P.], seq 485:577, ack 2400, win 2523, options [nop,nop,TS val 3504501259 ecr 3038163190], length 92
04:03:59.006823 IP ip-172-31-72-201.ec2.internal.ssh > ec2-35-172-155-192.compute-1.amazonaws.com.59244: Flags [.], ack 577, win 6376, options [nop,nop,TS val 3038163337 ecr 3504501259], length 0
04:03:59.659006 IP ec2-35-172-155-192.compute-1.amazonaws.com.59244 > ip-172-31-72-201.ec2.internal.ssh: Flags [P.], seq 577:677, ack 2400, win 2523, options [nop,nop,TS val 3504501952 ecr 3038163337], length 100
04:03:59.659059 IP ip-172-31-72-201.ec2.internal.ssh > ec2-35-172-155-192.compute-1.amazonaws.com.59244: Flags [.], ack 677, win 6376, options [nop,nop,TS val 3038163989 ecr 3504501952], length 0
04:03:59.659702 IP ip-172-31-72-201.ec2.internal.ssh > ec2-35-172-155-192.compute-1.amazonaws.com.59244: Flags [P.], seq 2400:2644, ack 677, win 6376, options [nop,nop,TS val 3038163990 ecr 3504501952], length 244
04:03:59.668406 IP ec2-35-172-155-192.compute-1.amazonaws.com.59244 > ip-172-31-72-201.ec2.internal.ssh: Flags [.], ack 2644, win 2522, options [nop,nop,TS val 3504501962 ecr 3038163990], length 0
04:04:00.711426 IP ec2-35-172-155-192.compute-1.amazonaws.com.59244 > ip-172-31-72-201.ec2.internal.ssh: Flags [P.], seq 677:777, ack 2644, win 2523, options [nop,nop,TS val 3504503005 ecr 3038163990], length 100
04:04:00.712150 IP ip-172-31-72-201.ec2.internal.ssh > ec2-35-172-155-192.compute-1.amazonaws.com.59244: Flags [P.], seq 2644:2888, ack 777, win 6376, options [nop,nop,TS val 3038165042 ecr 3504503005], length 244
04:04:00.719061 IP ec2-35-172-155-192.compute-1.amazonaws.com.59244 > ip-172-31-72-201.ec2.internal.ssh: Flags [.], ack 2888, win 2522, options [nop,nop,TS val 3504503012 ecr 3038165042], length 0
04:04:01.761751 IP ec2-35-172-155-192.compute-1.amazonaws.com.59244 > ip-172-31-72-201.ec2.internal.ssh: Flags [P.], seq 777:877, ack 2888, win 2523, options [nop,nop,TS val 3504504055 ecr 3038165042], length 100
04:04:01.762466 IP ip-172-31-72-201.ec2.internal.ssh > ec2-35-172-155-192.compute-1.amazonaws.com.59244: Flags [P.], seq 2888:3132, ack 877, win 6376, options [nop,nop,TS val 3038166093 ecr 3504504055], length 244
04:04:01.763951 IP ec2-35-172-155-192.compute-1.amazonaws.com.59244 > ip-172-31-72-201.ec2.internal.ssh: Flags [.], ack 3132, win 2522, options [nop,nop,TS val 3504504057 ecr 3038166093], length 0
04:04:02.114429 IP ip-172-31-72-201.ec2.internal.ssh > ec2-35-172-155-192.compute-1.amazonaws.com.59244: Flags [P.], seq 3132:3640, ack 877, win 6376, options [nop,nop,TS val 3038166445 ecr 3504504057], length 508
04:04:02.115439 IP ec2-35-172-155-192.compute-1.amazonaws.com.59244 > ip-172-31-72-201.ec2.internal.ssh: Flags [.], ack 3640, win 2519, options [nop,nop,TS val 3504504409 ecr 3038166445], length 0
04:04:02.226233 IP ec2-35-172-155-192.compute-1.amazonaws.com.59244 > ip-172-31-72-201.ec2.internal.ssh: Flags [P.], seq 877:953, ack 3640, win 2523, options [nop,nop,TS val 3504504520 ecr 3038166445], length 76
04:04:02.230546 IP ec2-35-172-155-192.compute-1.amazonaws.com.59244 > ip-172-31-72-201.ec2.internal.ssh: Flags [P.], seq 953:1109, ack 3640, win 2523, options [nop,nop,TS val 3504504524 ecr 3038166445], length 156
04:04:02.230609 IP ip-172-31-72-201.ec2.internal.ssh > ec2-35-172-155-192.compute-1.amazonaws.com.59244: Flags [.], ack 1109, win 6376, options [nop,nop,TS val 3038166561 ecr 3504504520], length 0
04:04:02.230892 IP ip-172-31-72-201.ec2.internal.ssh > ec2-35-172-155-192.compute-1.amazonaws.com.59244: Flags [P.], seq 3640:3764, ack 1109, win 6376, options [nop,nop,TS val 3038166561 ecr 3504504520], length 124
04:04:02.231161 IP ip-172-31-72-201.ec2.internal.ssh > ec2-35-172-155-192.compute-1.amazonaws.com.59244: Flags [P.], seq 3764:3816, ack 1109, win 6376, options [nop,nop,TS val 3038166561 ecr 3504504520], length 52
04:04:02.231979 IP ec2-35-172-155-192.compute-1.amazonaws.com.59244 > ip-172-31-72-201.ec2.internal.ssh: Flags [.], ack 3764, win 2523, options [nop,nop,TS val 3504504525 ecr 3038166561], length 0
04:04:02.232080 IP ec2-35-172-155-192.compute-1.amazonaws.com.59244 > ip-172-31-72-201.ec2.internal.ssh: Flags [.], ack 3816, win 2523, options [nop,nop,TS val 3504504525 ecr 3038166561], length 0
04:04:02.531783 IP ec2-35-172-155-192.compute-1.amazonaws.com.59244 > ip-172-31-72-201.ec2.internal.ssh: Flags [P.], seq 1109:1313, ack 3816, win 2523, options [nop,nop,TS val 3504504825 ecr 3038166561], length 204
04:04:02.532523 IP ip-172-31-72-201.ec2.internal.ssh > ec2-35-172-155-192.compute-1.amazonaws.com.59244: Flags [P.], seq 3816:3876, ack 1313, win 6376, options [nop,nop,TS val 3038166863 ecr 3504504825], length 60
04:04:02.533506 IP ec2-35-172-155-192.compute-1.amazonaws.com.59244 > ip-172-31-72-201.ec2.internal.ssh: Flags [.], ack 3876, win 2523, options [nop,nop,TS val 3504504827 ecr 3038166863], length 0
04:04:02.536284 IP ip-172-31-72-201.ec2.internal.ssh > ec2-35-172-155-192.compute-1.amazonaws.com.59244: Flags [P.], seq 3876:3928, ack 1313, win 6376, options [nop,nop,TS val 3038166867 ecr 3504504827], length 52
04:04:02.536675 IP ec2-35-172-155-192.compute-1.amazonaws.com.59244 > ip-172-31-72-201.ec2.internal.ssh: Flags [P.], seq 1313:1357, ack 3876, win 2523, options [nop,nop,TS val 3504504830 ecr 3038166863], length 44
04:04:02.536689 IP ec2-35-172-155-192.compute-1.amazonaws.com.59244 > ip-172-31-72-201.ec2.internal.ssh: Flags [P.], seq 1357:1697, ack 3876, win 2523, options [nop,nop,TS val 3504504830 ecr 3038166863], length 340
04:04:02.536710 IP ip-172-31-72-201.ec2.internal.ssh > ec2-35-172-155-192.compute-1.amazonaws.com.59244: Flags [.], ack 1697, win 6376, options [nop,nop,TS val 3038166867 ecr 3504504830], length 0
04:04:02.537092 IP ip-172-31-72-201.ec2.internal.ssh > ec2-35-172-155-192.compute-1.amazonaws.com.59244: Flags [P.], seq 3928:3988, ack 1697, win 6376, options [nop,nop,TS val 3038166867 ecr 3504504830], length 60
04:04:02.538028 IP ec2-35-172-155-192.compute-1.amazonaws.com.59244 > ip-172-31-72-201.ec2.internal.ssh: Flags [.], ack 3988, win 2523, options [nop,nop,TS val 3504504831 ecr 3038166867], length 0
04:04:02.540435 IP ip-172-31-72-201.ec2.internal.ssh > ec2-35-172-155-192.compute-1.amazonaws.com.59244: Flags [P.], seq 3988:4040, ack 1697, win 6376, options [nop,nop,TS val 3038166871 ecr 3504504831], length 52
04:04:02.571865 IP ec2-35-172-155-192.compute-1.amazonaws.com.59244 > ip-172-31-72-201.ec2.internal.ssh: Flags [P.], seq 1697:1773, ack 4040, win 2523, options [nop,nop,TS val 3504504865 ecr 3038166871], length 76
04:04:02.614830 IP ip-172-31-72-201.ec2.internal.ssh > ec2-35-172-155-192.compute-1.amazonaws.com.59244: Flags [.], ack 1773, win 6376, options [nop,nop,TS val 3038166945 ecr 3504504865], length 0
04:04:02.891201 IP ip-172-31-72-201.ec2.internal.ssh > ec2-35-172-155-192.compute-1.amazonaws.com.59244: Flags [P.], seq 4040:4548, ack 1773, win 6376, options [nop,nop,TS val 3038167221 ecr 3504504865], length 508
04:04:02.892996 IP ec2-35-172-155-192.compute-1.amazonaws.com.59244 > ip-172-31-72-201.ec2.internal.ssh: Flags [P.], seq 1773:1817, ack 4548, win 2523, options [nop,nop,TS val 3504505186 ecr 3038167221], length 44
04:04:02.893042 IP ip-172-31-72-201.ec2.internal.ssh > ec2-35-172-155-192.compute-1.amazonaws.com.59244: Flags [.], ack 1817, win 6376, options [nop,nop,TS val 3038167223 ecr 3504505186], length 0
04:04:02.893050 IP ec2-35-172-155-192.compute-1.amazonaws.com.59244 > ip-172-31-72-201.ec2.internal.ssh: Flags [P.], seq 1817:1877, ack 4548, win 2523, options [nop,nop,TS val 3504505186 ecr 3038167221], length 60
04:04:02.893057 IP ip-172-31-72-201.ec2.internal.ssh > ec2-35-172-155-192.compute-1.amazonaws.com.59244: Flags [.], ack 1877, win 6376, options [nop,nop,TS val 3038167223 ecr 3504505186], length 0
04:04:02.893060 IP ec2-35-172-155-192.compute-1.amazonaws.com.59244 > ip-172-31-72-201.ec2.internal.ssh: Flags [P.], seq 1877:1973, ack 4548, win 2523, options [nop,nop,TS val 3504505186 ecr 3038167221], length 96
04:04:02.893065 IP ip-172-31-72-201.ec2.internal.ssh > ec2-35-172-155-192.compute-1.amazonaws.com.59244: Flags [.], ack 1973, win 6376, options [nop,nop,TS val 3038167223 ecr 3504505186], length 0
04:04:02.893068 IP ec2-35-172-155-192.compute-1.amazonaws.com.59244 > ip-172-31-72-201.ec2.internal.ssh: Flags [P.], seq 1973:2105, ack 4548, win 2523, options [nop,nop,TS val 3504505186 ecr 3038167221], length 132
04:04:02.893072 IP ip-172-31-72-201.ec2.internal.ssh > ec2-35-172-155-192.compute-1.amazonaws.com.59244: Flags [.], ack 2105, win 6376, options [nop,nop,TS val 3038167223 ecr 3504505186], length 0
04:04:03.865498 IP ip-172-31-72-201.ec2.internal.ssh > ec2-35-172-155-192.compute-1.amazonaws.com.59244: Flags [P.], seq 4548:4640, ack 2105, win 6376, options [nop,nop,TS val 3038168196 ecr 3504505186], length 92
04:04:03.868091 IP ec2-35-172-155-192.compute-1.amazonaws.com.59244 > ip-172-31-72-201.ec2.internal.ssh: Flags [P.], seq 2105:2157, ack 4640, win 2523, options [nop,nop,TS val 3504506161 ecr 3038168196], length 52
04:04:03.868134 IP ip-172-31-72-201.ec2.internal.ssh > ec2-35-172-155-192.compute-1.amazonaws.com.59244: Flags [.], ack 2157, win 6376, options [nop,nop,TS val 3038168198 ecr 3504506161], length 0
04:04:03.868155 IP ec2-35-172-155-192.compute-1.amazonaws.com.59244 > ip-172-31-72-201.ec2.internal.ssh: Flags [P.], seq 2157:2233, ack 4640, win 2523, options [nop,nop,TS val 3504506161 ecr 3038168196], length 76
04:04:03.868159 IP ec2-35-172-155-192.compute-1.amazonaws.com.59244 > ip-172-31-72-201.ec2.internal.ssh: Flags [P.], seq 2233:2321, ack 4640, win 2523, options [nop,nop,TS val 3504506162 ecr 3038168196], length 88
04:04:03.868172 IP ip-172-31-72-201.ec2.internal.ssh > ec2-35-172-155-192.compute-1.amazonaws.com.59244: Flags [.], ack 2233, win 6376, options [nop,nop,TS val 3038168198 ecr 3504506161], length 0
04:04:03.868179 IP ip-172-31-72-201.ec2.internal.ssh > ec2-35-172-155-192.compute-1.amazonaws.com.59244: Flags [.], ack 2321, win 6376, options [nop,nop,TS val 3038168199 ecr 3504506162], length 0
04:04:03.868308 IP ec2-35-172-155-192.compute-1.amazonaws.com.59244 > ip-172-31-72-201.ec2.internal.ssh: Flags [P.], seq 2321:2409, ack 4640, win 2523, options [nop,nop,TS val 3504506162 ecr 3038168196], length 88
04:04:03.868334 IP ip-172-31-72-201.ec2.internal.ssh > ec2-35-172-155-192.compute-1.amazonaws.com.59244: Flags [.], ack 2409, win 6376, options [nop,nop,TS val 3038168199 ecr 3504506162], length 0
04:04:03.903606 IP ec2-35-172-155-192.compute-1.amazonaws.com.59244 > ip-172-31-72-201.ec2.internal.ssh: Flags [P.], seq 2409:2485, ack 4640, win 2523, options [nop,nop,TS val 3504506197 ecr 3038168199], length 76
04:04:03.903653 IP ip-172-31-72-201.ec2.internal.ssh > ec2-35-172-155-192.compute-1.amazonaws.com.59244: Flags [.], ack 2485, win 6376, options [nop,nop,TS val 3038168234 ecr 3504506197], length 0
04:04:03.903666 IP ec2-35-172-155-192.compute-1.amazonaws.com.59244 > ip-172-31-72-201.ec2.internal.ssh: Flags [P.], seq 2485:2561, ack 4640, win 2523, options [nop,nop,TS val 3504506197 ecr 3038168199], length 76
04:04:03.903679 IP ip-172-31-72-201.ec2.internal.ssh > ec2-35-172-155-192.compute-1.amazonaws.com.59244: Flags [.], ack 2561, win 6376, options [nop,nop,TS val 3038168234 ecr 3504506197], length 0
04:04:03.903701 IP ec2-35-172-155-192.compute-1.amazonaws.com.59244 > ip-172-31-72-201.ec2.internal.ssh: Flags [P.], seq 2561:2637, ack 4640, win 2523, options [nop,nop,TS val 3504506197 ecr 3038168199], length 76
04:04:03.903708 IP ip-172-31-72-201.ec2.internal.ssh > ec2-35-172-155-192.compute-1.amazonaws.com.59244: Flags [.], ack 2637, win 6376, options [nop,nop,TS val 3038168234 ecr 3504506197], length 0
04:04:03.903712 IP ec2-35-172-155-192.compute-1.amazonaws.com.59244 > ip-172-31-72-201.ec2.internal.ssh: Flags [P.], seq 2637:2741, ack 4640, win 2523, options [nop,nop,TS val 3504506197 ecr 3038168199], length 104
04:04:03.903720 IP ip-172-31-72-201.ec2.internal.ssh > ec2-35-172-155-192.compute-1.amazonaws.com.59244: Flags [.], ack 2741, win 6376, options [nop,nop,TS val 3038168234 ecr 3504506197], length 0
04:04:03.903776 IP ec2-35-172-155-192.compute-1.amazonaws.com.59244 > ip-172-31-72-201.ec2.internal.ssh: Flags [P.], seq 2741:2897, ack 4640, win 2523, options [nop,nop,TS val 3504506197 ecr 3038168199], length 156
04:04:03.903789 IP ip-172-31-72-201.ec2.internal.ssh > ec2-35-172-155-192.compute-1.amazonaws.com.59244: Flags [.], ack 2897, win 6376, options [nop,nop,TS val 3038168234 ecr 3504506197], length 0
04:04:03.903796 IP ec2-35-172-155-192.compute-1.amazonaws.com.59244 > ip-172-31-72-201.ec2.internal.ssh: Flags [P.], seq 2897:3073, ack 4640, win 2523, options [nop,nop,TS val 3504506197 ecr 3038168199], length 176
04:04:03.903800 IP ip-172-31-72-201.ec2.internal.ssh > ec2-35-172-155-192.compute-1.amazonaws.com.59244: Flags [.], ack 3073, win 6376, options [nop,nop,TS val 3038168234 ecr 3504506197], length 0
04:04:03.903826 IP ec2-35-172-155-192.compute-1.amazonaws.com.59244 > ip-172-31-72-201.ec2.internal.ssh: Flags [P.], seq 3073:3177, ack 4640, win 2523, options [nop,nop,TS val 3504506197 ecr 3038168199], length 104
04:04:03.903836 IP ip-172-31-72-201.ec2.internal.ssh > ec2-35-172-155-192.compute-1.amazonaws.com.59244: Flags [.], ack 3177, win 6376, options [nop,nop,TS val 3038168234 ecr 3504506197], length 0
04:04:03.903919 IP ec2-35-172-155-192.compute-1.amazonaws.com.59244 > ip-172-31-72-201.ec2.internal.ssh: Flags [P.], seq 3177:3229, ack 4640, win 2523, options [nop,nop,TS val 3504506197 ecr 3038168199], length 52
04:04:03.903928 IP ip-172-31-72-201.ec2.internal.ssh > ec2-35-172-155-192.compute-1.amazonaws.com.59244: Flags [.], ack 3229, win 6376, options [nop,nop,TS val 3038168234 ecr 3504506197], length 0
04:04:03.904284 IP ec2-35-172-155-192.compute-1.amazonaws.com.59244 > ip-172-31-72-201.ec2.internal.ssh: Flags [P.], seq 3229:3297, ack 4640, win 2523, options [nop,nop,TS val 3504506198 ecr 3038168199], length 68
04:04:03.904303 IP ip-172-31-72-201.ec2.internal.ssh > ec2-35-172-155-192.compute-1.amazonaws.com.59244: Flags [.], ack 3297, win 6376, options [nop,nop,TS val 3038168235 ecr 3504506198], length 0
04:04:03.914957 IP ip-172-31-72-201.ec2.internal.ssh > ec2-35-172-155-192.compute-1.amazonaws.com.59244: Flags [P.], seq 4640:4796, ack 3297, win 6376, options [nop,nop,TS val 3038168245 ecr 3504506198], length 156
04:04:03.915980 IP ip-172-31-72-201.ec2.internal.ssh > ec2-35-172-155-192.compute-1.amazonaws.com.59244: Flags [P.], seq 4796:4884, ack 3297, win 6376, options [nop,nop,TS val 3038168246 ecr 3504506198], length 88
04:04:03.917318 IP ec2-35-172-155-192.compute-1.amazonaws.com.59244 > ip-172-31-72-201.ec2.internal.ssh: Flags [P.], seq 3297:3381, ack 4796, win 2523, options [nop,nop,TS val 3504506211 ecr 3038168245], length 84
04:04:03.918542 IP ip-172-31-72-201.ec2.internal.ssh > ec2-35-172-155-192.compute-1.amazonaws.com.59244: Flags [P.], seq 4884:4928, ack 3381, win 6376, options [nop,nop,TS val 3038168249 ecr 3504506211], length 44
04:04:03.919910 IP ip-172-31-72-201.ec2.internal.ssh > ec2-35-172-155-192.compute-1.amazonaws.com.59244: Flags [P.], seq 4928:5016, ack 3381, win 6376, options [nop,nop,TS val 3038168250 ecr 3504506211], length 88
04:04:03.922604 IP ip-172-31-72-201.ec2.internal.ssh > ec2-35-172-155-192.compute-1.amazonaws.com.59244: Flags [P.], seq 5016:5528, ack 3381, win 6376, options [nop,nop,TS val 3038168253 ecr 3504506211], length 512
04:04:03.923391 IP ec2-35-172-155-192.compute-1.amazonaws.com.59244 > ip-172-31-72-201.ec2.internal.ssh: Flags [.], ack 4928, win 2523, options [nop,nop,TS val 3504506217 ecr 3038168246], length 0
04:04:03.927273 IP ec2-35-172-155-192.compute-1.amazonaws.com.59244 > ip-172-31-72-201.ec2.internal.ssh: Flags [.], ack 5528, win 2523, options [nop,nop,TS val 3504506221 ecr 3038168250], length 0
04:04:04.047885 IP ec2-35-172-155-192.compute-1.amazonaws.com.59244 > ip-172-31-72-201.ec2.internal.ssh: Flags [P.], seq 3381:3521, ack 5528, win 2523, options [nop,nop,TS val 3504506341 ecr 3038168250], length 140
04:04:04.048864 IP ip-172-31-72-201.ec2.internal.ssh > ec2-35-172-155-192.compute-1.amazonaws.com.59244: Flags [P.], seq 5528:5628, ack 3521, win 6376, options [nop,nop,TS val 3038168379 ecr 3504506341], length 100
04:04:04.049078 IP ip-172-31-72-201.ec2.internal.ssh > ec2-35-172-155-192.compute-1.amazonaws.com.59244: Flags [P.], seq 5628:5672, ack 3521, win 6376, options [nop,nop,TS val 3038168379 ecr 3504506341], length 44
04:04:04.049101 IP ip-172-31-72-201.ec2.internal.ssh > ec2-35-172-155-192.compute-1.amazonaws.com.59244: Flags [P.], seq 5672:5796, ack 3521, win 6376, options [nop,nop,TS val 3038168379 ecr 3504506341], length 124
04:04:04.049421 IP ip-172-31-72-201.ec2.internal.ssh > ec2-35-172-155-192.compute-1.amazonaws.com.59244: Flags [P.], seq 5796:5936, ack 3521, win 6376, options [nop,nop,TS val 3038168380 ecr 3504506341], length 140
04:04:04.049556 IP ip-172-31-72-201.ec2.internal.ssh > ec2-35-172-155-192.compute-1.amazonaws.com.59244: Flags [P.], seq 5936:6076, ack 3521, win 6376, options [nop,nop,TS val 3038168380 ecr 3504506341], length 140
04:04:04.049729 IP ip-172-31-72-201.ec2.internal.ssh > ec2-35-172-155-192.compute-1.amazonaws.com.59244: Flags [P.], seq 6076:6216, ack 3521, win 6376, options [nop,nop,TS val 3038168380 ecr 3504506341], length 140
04:04:04.049879 IP ip-172-31-72-201.ec2.internal.ssh > ec2-35-172-155-192.compute-1.amazonaws.com.59244: Flags [P.], seq 6216:6392, ack 3521, win 6376, options [nop,nop,TS val 3038168380 ecr 3504506341], length 176
04:04:04.050087 IP ec2-35-172-155-192.compute-1.amazonaws.com.59244 > ip-172-31-72-201.ec2.internal.ssh: Flags [.], ack 5672, win 2523, options [nop,nop,TS val 3504506343 ecr 3038168379], length 0
04:04:04.050115 IP ip-172-31-72-201.ec2.internal.ssh > ec2-35-172-155-192.compute-1.amazonaws.com.59244: Flags [P.], seq 6392:6436, ack 3521, win 6376, options [nop,nop,TS val 3038168380 ecr 3504506343], length 44
04:04:04.050173 IP ip-172-31-72-201.ec2.internal.ssh > ec2-35-172-155-192.compute-1.amazonaws.com.59244: Flags [P.], seq 6436:6568, ack 3521, win 6376, options [nop,nop,TS val 3038168381 ecr 3504506343], length 132
04:04:04.050379 IP ip-172-31-72-201.ec2.internal.ssh > ec2-35-172-155-192.compute-1.amazonaws.com.59244: Flags [P.], seq 6568:6708, ack 3521, win 6376, options [nop,nop,TS val 3038168381 ecr 3504506343], length 140
04:04:04.050410 IP ec2-35-172-155-192.compute-1.amazonaws.com.59244 > ip-172-31-72-201.ec2.internal.ssh: Flags [.], ack 5936, win 2523, options [nop,nop,TS val 3504506344 ecr 3038168379], length 0
04:04:04.050618 IP ip-172-31-72-201.ec2.internal.ssh > ec2-35-172-155-192.compute-1.amazonaws.com.59244: Flags [P.], seq 6708:6848, ack 3521, win 6376, options [nop,nop,TS val 3038168381 ecr 3504506344], length 140
04:04:04.050856 IP ec2-35-172-155-192.compute-1.amazonaws.com.59244 > ip-172-31-72-201.ec2.internal.ssh: Flags [.], ack 6216, win 2523, options [nop,nop,TS val 3504506344 ecr 3038168380], length 0
04:04:04.050879 IP ip-172-31-72-201.ec2.internal.ssh > ec2-35-172-155-192.compute-1.amazonaws.com.59244: Flags [P.], seq 6848:6908, ack 3521, win 6376, options [nop,nop,TS val 3038168381 ecr 3504506344], length 60
04:04:04.051045 IP ec2-35-172-155-192.compute-1.amazonaws.com.59244 > ip-172-31-72-201.ec2.internal.ssh: Flags [.], ack 6436, win 2523, options [nop,nop,TS val 3504506344 ecr 3038168380], length 0
04:04:04.051253 IP ec2-35-172-155-192.compute-1.amazonaws.com.59244 > ip-172-31-72-201.ec2.internal.ssh: Flags [P.], seq 3521:3565, ack 6568, win 2523, options [nop,nop,TS val 3504506345 ecr 3038168381], length 44
04:04:04.051274 IP ec2-35-172-155-192.compute-1.amazonaws.com.59244 > ip-172-31-72-201.ec2.internal.ssh: Flags [P.], seq 3565:3705, ack 6568, win 2523, options [nop,nop,TS val 3504506345 ecr 3038168381], length 140
04:04:04.051312 IP ip-172-31-72-201.ec2.internal.ssh > ec2-35-172-155-192.compute-1.amazonaws.com.59244: Flags [.], ack 3705, win 6376, options [nop,nop,TS val 3038168382 ecr 3504506345], length 0
04:04:04.051738 IP ip-172-31-72-201.ec2.internal.ssh > ec2-35-172-155-192.compute-1.amazonaws.com.59244: Flags [P.], seq 6908:6952, ack 3705, win 6376, options [nop,nop,TS val 3038168382 ecr 3504506345], length 44
04:04:04.051758 IP ip-172-31-72-201.ec2.internal.ssh > ec2-35-172-155-192.compute-1.amazonaws.com.59244: Flags [P.], seq 6952:7204, ack 3705, win 6376, options [nop,nop,TS val 3038168382 ecr 3504506345], length 252
04:04:04.052002 IP ec2-35-172-155-192.compute-1.amazonaws.com.59244 > ip-172-31-72-201.ec2.internal.ssh: Flags [P.], seq 3705:3853, ack 6708, win 2523, options [nop,nop,TS val 3504506345 ecr 3038168381], length 148
04:04:04.052306 IP ec2-35-172-155-192.compute-1.amazonaws.com.59244 > ip-172-31-72-201.ec2.internal.ssh: Flags [.], ack 6908, win 2523, options [nop,nop,TS val 3504506346 ecr 3038168381], length 0
04:04:04.053563 IP ec2-35-172-155-192.compute-1.amazonaws.com.59244 > ip-172-31-72-201.ec2.internal.ssh: Flags [P.], seq 3853:3913, ack 6908, win 2523, options [nop,nop,TS val 3504506347 ecr 3038168381], length 60
04:04:04.053618 IP ip-172-31-72-201.ec2.internal.ssh > ec2-35-172-155-192.compute-1.amazonaws.com.59244: Flags [.], ack 3913, win 6376, options [nop,nop,TS val 3038168384 ecr 3504506345], length 0
04:04:04.053751 IP ec2-35-172-155-192.compute-1.amazonaws.com.59244 > ip-172-31-72-201.ec2.internal.ssh: Flags [P.], seq 3913:3957, ack 6908, win 2523, options [nop,nop,TS val 3504506347 ecr 3038168381], length 44
04:04:04.053778 IP ec2-35-172-155-192.compute-1.amazonaws.com.59244 > ip-172-31-72-201.ec2.internal.ssh: Flags [P.], seq 3957:4113, ack 6908, win 2523, options [nop,nop,TS val 3504506347 ecr 3038168381], length 156
04:04:04.053792 IP ip-172-31-72-201.ec2.internal.ssh > ec2-35-172-155-192.compute-1.amazonaws.com.59244: Flags [.], ack 4113, win 6376, options [nop,nop,TS val 3038168384 ecr 3504506347], length 0
04:04:04.054258 IP ip-172-31-72-201.ec2.internal.ssh > ec2-35-172-155-192.compute-1.amazonaws.com.59244: Flags [P.], seq 7204:7296, ack 4113, win 6376, options [nop,nop,TS val 3038168385 ecr 3504506347], length 92
04:04:04.054349 IP ip-172-31-72-201.ec2.internal.ssh > ec2-35-172-155-192.compute-1.amazonaws.com.59244: Flags [P.], seq 7296:7432, ack 4113, win 6376, options [nop,nop,TS val 3038168385 ecr 3504506347], length 136
04:04:04.054835 IP ec2-35-172-155-192.compute-1.amazonaws.com.59244 > ip-172-31-72-201.ec2.internal.ssh: Flags [P.], seq 4113:4157, ack 6908, win 2523, options [nop,nop,TS val 3504506348 ecr 3038168381], length 44
04:04:04.054872 IP ec2-35-172-155-192.compute-1.amazonaws.com.59244 > ip-172-31-72-201.ec2.internal.ssh: Flags [P.], seq 4157:4321, ack 6908, win 2523, options [nop,nop,TS val 3504506348 ecr 3038168381], length 164
04:04:04.054926 IP ip-172-31-72-201.ec2.internal.ssh > ec2-35-172-155-192.compute-1.amazonaws.com.59244: Flags [.], ack 4321, win 6376, options [nop,nop,TS val 3038168385 ecr 3504506348], length 0
04:04:04.055236 IP ip-172-31-72-201.ec2.internal.ssh > ec2-35-172-155-192.compute-1.amazonaws.com.59244: Flags [P.], seq 7432:8160, ack 4321, win 6376, options [nop,nop,TS val 3038168386 ecr 3504506348], length 728
04:04:04.055264 IP ec2-35-172-155-192.compute-1.amazonaws.com.59244 > ip-172-31-72-201.ec2.internal.ssh: Flags [.], ack 7204, win 2523, options [nop,nop,TS val 3504506348 ecr 3038168382], length 0
04:04:04.055984 IP ip-172-31-72-201.ec2.internal.ssh > ec2-35-172-155-192.compute-1.amazonaws.com.59244: Flags [P.], seq 8160:8896, ack 4321, win 6376, options [nop,nop,TS val 3038168386 ecr 3504506348], length 736
04:04:04.056351 IP ec2-35-172-155-192.compute-1.amazonaws.com.59244 > ip-172-31-72-201.ec2.internal.ssh: Flags [.], ack 7432, win 2523, options [nop,nop,TS val 3504506350 ecr 3038168385], length 0
04:04:04.056367 IP ip-172-31-72-201.ec2.internal.ssh > ec2-35-172-155-192.compute-1.amazonaws.com.59244: Flags [P.], seq 8896:9488, ack 4321, win 6376, options [nop,nop,TS val 3038168387 ecr 3504506350], length 592
04:04:04.056483 IP ip-172-31-72-201.ec2.internal.ssh > ec2-35-172-155-192.compute-1.amazonaws.com.59244: Flags [P.], seq 9488:9548, ack 4321, win 6376, options [nop,nop,TS val 3038168387 ecr 3504506350], length 60
04:04:04.056883 IP ec2-35-172-155-192.compute-1.amazonaws.com.59244 > ip-172-31-72-201.ec2.internal.ssh: Flags [P.], seq 4321:4501, ack 7432, win 2523, options [nop,nop,TS val 3504506350 ecr 3038168385], length 180
04:04:04.057252 IP ip-172-31-72-201.ec2.internal.ssh > ec2-35-172-155-192.compute-1.amazonaws.com.59244: Flags [P.], seq 9548:9640, ack 4501, win 6376, options [nop,nop,TS val 3038168388 ecr 3504506350], length 92
04:04:04.057361 IP ec2-35-172-155-192.compute-1.amazonaws.com.59244 > ip-172-31-72-201.ec2.internal.ssh: Flags [.], ack 8896, win 2523, options [nop,nop,TS val 3504506351 ecr 3038168386], length 0
04:04:04.058120 IP ec2-35-172-155-192.compute-1.amazonaws.com.59244 > ip-172-31-72-201.ec2.internal.ssh: Flags [.], ack 9548, win 2523, options [nop,nop,TS val 3504506351 ecr 3038168387], length 0
04:04:04.060067 IP ec2-35-172-155-192.compute-1.amazonaws.com.59244 > ip-172-31-72-201.ec2.internal.ssh: Flags [P.], seq 4501:4561, ack 9640, win 2523, options [nop,nop,TS val 3504506353 ecr 3038168388], length 60
04:04:04.061262 IP ec2-35-172-155-192.compute-1.amazonaws.com.59244 > ip-172-31-72-201.ec2.internal.ssh: Flags [P.], seq 4561:4621, ack 9640, win 2523, options [nop,nop,TS val 3504506355 ecr 3038168388], length 60
04:04:04.061306 IP ip-172-31-72-201.ec2.internal.ssh > ec2-35-172-155-192.compute-1.amazonaws.com.59244: Flags [.], ack 4621, win 6376, options [nop,nop,TS val 3038168392 ecr 3504506353], length 0
04:04:04.095248 IP ec2-35-172-155-192.compute-1.amazonaws.com.59244 > ip-172-31-72-201.ec2.internal.ssh: Flags [P.], seq 4621:4665, ack 9640, win 2523, options [nop,nop,TS val 3504506389 ecr 3038168392], length 44
04:04:04.095359 IP ec2-35-172-155-192.compute-1.amazonaws.com.59244 > ip-172-31-72-201.ec2.internal.ssh: Flags [P.], seq 4665:4797, ack 9640, win 2523, options [nop,nop,TS val 3504506389 ecr 3038168392], length 132
04:04:04.095414 IP ip-172-31-72-201.ec2.internal.ssh > ec2-35-172-155-192.compute-1.amazonaws.com.59244: Flags [.], ack 4797, win 6376, options [nop,nop,TS val 3038168426 ecr 3504506389], length 0
04:04:04.095760 IP ip-172-31-72-201.ec2.internal.ssh > ec2-35-172-155-192.compute-1.amazonaws.com.59244: Flags [P.], seq 9640:9716, ack 4797, win 6376, options [nop,nop,TS val 3038168426 ecr 3504506389], length 76
04:04:04.096434 IP ec2-35-172-155-192.compute-1.amazonaws.com.59244 > ip-172-31-72-201.ec2.internal.ssh: Flags [P.], seq 4797:4841, ack 9640, win 2523, options [nop,nop,TS val 3504506390 ecr 3038168392], length 44
04:04:04.096465 IP ec2-35-172-155-192.compute-1.amazonaws.com.59244 > ip-172-31-72-201.ec2.internal.ssh: Flags [P.], seq 4841:4941, ack 9640, win 2523, options [nop,nop,TS val 3504506390 ecr 3038168392], length 100
04:04:04.096490 IP ip-172-31-72-201.ec2.internal.ssh > ec2-35-172-155-192.compute-1.amazonaws.com.59244: Flags [.], ack 4941, win 6376, options [nop,nop,TS val 3038168427 ecr 3504506390], length 0
04:04:04.097361 IP ec2-35-172-155-192.compute-1.amazonaws.com.59244 > ip-172-31-72-201.ec2.internal.ssh: Flags [P.], seq 4941:4985, ack 9640, win 2523, options [nop,nop,TS val 3504506391 ecr 3038168392], length 44
04:04:04.097472 IP ec2-35-172-155-192.compute-1.amazonaws.com.59244 > ip-172-31-72-201.ec2.internal.ssh: Flags [P.], seq 4985:5117, ack 9640, win 2523, options [nop,nop,TS val 3504506391 ecr 3038168392], length 132
04:04:04.097540 IP ip-172-31-72-201.ec2.internal.ssh > ec2-35-172-155-192.compute-1.amazonaws.com.59244: Flags [.], ack 5117, win 6376, options [nop,nop,TS val 3038168428 ecr 3504506391], length 0
04:04:04.101281 IP ip-172-31-72-201.ec2.internal.ssh > ec2-35-172-155-192.compute-1.amazonaws.com.59244: Flags [P.], seq 9716:10444, ack 5117, win 6376, options [nop,nop,TS val 3038168432 ecr 3504506391], length 728
04:04:04.103962 IP ec2-35-172-155-192.compute-1.amazonaws.com.59244 > ip-172-31-72-201.ec2.internal.ssh: Flags [P.], seq 5117:5233, ack 9716, win 2523, options [nop,nop,TS val 3504506397 ecr 3038168426], length 116
04:04:04.104359 IP ip-172-31-72-201.ec2.internal.ssh > ec2-35-172-155-192.compute-1.amazonaws.com.59244: Flags [P.], seq 10444:10512, ack 5233, win 6376, options [nop,nop,TS val 3038168435 ecr 3504506397], length 68
04:04:04.106042 IP ip-172-31-72-201.ec2.internal.ssh > ec2-35-172-155-192.compute-1.amazonaws.com.59244: Flags [P.], seq 10512:10660, ack 5233, win 6376, options [nop,nop,TS val 3038168436 ecr 3504506397], length 148
04:04:04.107449 IP ip-172-31-72-201.ec2.internal.ssh > ec2-35-172-155-192.compute-1.amazonaws.com.59244: Flags [P.], seq 10660:10848, ack 5233, win 6376, options [nop,nop,TS val 3038168438 ecr 3504506397], length 188
04:04:04.108255 IP ec2-35-172-155-192.compute-1.amazonaws.com.59244 > ip-172-31-72-201.ec2.internal.ssh: Flags [.], ack 10660, win 2523, options [nop,nop,TS val 3504506402 ecr 3038168432], length 0
04:04:04.109153 IP ip-172-31-72-201.ec2.internal.ssh > ec2-35-172-155-192.compute-1.amazonaws.com.59244: Flags [P.], seq 10848:10936, ack 5233, win 6376, options [nop,nop,TS val 3038168439 ecr 3504506402], length 88
04:04:04.109983 IP ec2-35-172-155-192.compute-1.amazonaws.com.59244 > ip-172-31-72-201.ec2.internal.ssh: Flags [P.], seq 5233:5277, ack 10660, win 2523, options [nop,nop,TS val 3504506403 ecr 3038168432], length 44
04:04:04.110009 IP ec2-35-172-155-192.compute-1.amazonaws.com.59244 > ip-172-31-72-201.ec2.internal.ssh: Flags [P.], seq 5277:5385, ack 10660, win 2523, options [nop,nop,TS val 3504506403 ecr 3038168432], length 108
04:04:04.110037 IP ip-172-31-72-201.ec2.internal.ssh > ec2-35-172-155-192.compute-1.amazonaws.com.59244: Flags [.], ack 5385, win 6376, options [nop,nop,TS val 3038168440 ecr 3504506403], length 0
04:04:04.110289 IP ip-172-31-72-201.ec2.internal.ssh > ec2-35-172-155-192.compute-1.amazonaws.com.59244: Flags [P.], seq 10936:11004, ack 5385, win 6376, options [nop,nop,TS val 3038168441 ecr 3504506403], length 68
04:04:04.110486 IP ec2-35-172-155-192.compute-1.amazonaws.com.59244 > ip-172-31-72-201.ec2.internal.ssh: Flags [.], ack 10936, win 2523, options [nop,nop,TS val 3504506404 ecr 3038168438], length 0
04:04:04.110724 IP ip-172-31-72-201.ec2.internal.ssh > ec2-35-172-155-192.compute-1.amazonaws.com.59244: Flags [P.], seq 11004:11048, ack 5385, win 6376, options [nop,nop,TS val 3038168441 ecr 3504506404], length 44
04:04:04.110763 IP ip-172-31-72-201.ec2.internal.ssh > ec2-35-172-155-192.compute-1.amazonaws.com.59244: Flags [P.], seq 11048:11188, ack 5385, win 6376, options [nop,nop,TS val 3038168441 ecr 3504506404], length 140
04:04:04.111723 IP ec2-35-172-155-192.compute-1.amazonaws.com.59244 > ip-172-31-72-201.ec2.internal.ssh: Flags [.], ack 11048, win 2523, options [nop,nop,TS val 3504506405 ecr 3038168441], length 0
04:04:04.112593 IP ip-172-31-72-201.ec2.internal.ssh > ec2-35-172-155-192.compute-1.amazonaws.com.59244: Flags [P.], seq 11188:11544, ack 5385, win 6376, options [nop,nop,TS val 3038168443 ecr 3504506405], length 356
04:04:04.113714 IP ec2-35-172-155-192.compute-1.amazonaws.com.59244 > ip-172-31-72-201.ec2.internal.ssh: Flags [.], ack 11544, win 2523, options [nop,nop,TS val 3504506407 ecr 3038168441], length 0
04:04:04.113730 IP ip-172-31-72-201.ec2.internal.ssh > ec2-35-172-155-192.compute-1.amazonaws.com.59244: Flags [P.], seq 11544:11632, ack 5385, win 6376, options [nop,nop,TS val 3038168444 ecr 3504506407], length 88
04:04:04.113847 IP ec2-35-172-155-192.compute-1.amazonaws.com.59244 > ip-172-31-72-201.ec2.internal.ssh: Flags [P.], seq 5385:5445, ack 11544, win 2523, options [nop,nop,TS val 3504506407 ecr 3038168441], length 60
04:04:04.113871 IP ec2-35-172-155-192.compute-1.amazonaws.com.59244 > ip-172-31-72-201.ec2.internal.ssh: Flags [P.], seq 5445:5489, ack 11544, win 2523, options [nop,nop,TS val 3504506407 ecr 3038168441], length 44
04:04:04.113896 IP ip-172-31-72-201.ec2.internal.ssh > ec2-35-172-155-192.compute-1.amazonaws.com.59244: Flags [.], ack 5489, win 6376, options [nop,nop,TS val 3038168444 ecr 3504506407], length 0
04:04:04.113917 IP ec2-35-172-155-192.compute-1.amazonaws.com.59244 > ip-172-31-72-201.ec2.internal.ssh: Flags [P.], seq 5489:5621, ack 11544, win 2523, options [nop,nop,TS val 3504506407 ecr 3038168441], length 132
04:04:04.113974 IP ec2-35-172-155-192.compute-1.amazonaws.com.59244 > ip-172-31-72-201.ec2.internal.ssh: Flags [P.], seq 5621:5665, ack 11544, win 2523, options [nop,nop,TS val 3504506407 ecr 3038168441], length 44
04:04:04.114002 IP ec2-35-172-155-192.compute-1.amazonaws.com.59244 > ip-172-31-72-201.ec2.internal.ssh: Flags [P.], seq 5665:5797, ack 11544, win 2523, options [nop,nop,TS val 3504506407 ecr 3038168441], length 132
04:04:04.114003 IP ip-172-31-72-201.ec2.internal.ssh > ec2-35-172-155-192.compute-1.amazonaws.com.59244: Flags [.], ack 5665, win 6376, options [nop,nop,TS val 3038168444 ecr 3504506407], length 0
04:04:04.115910 IP ec2-35-172-155-192.compute-1.amazonaws.com.59244 > ip-172-31-72-201.ec2.internal.ssh: Flags [P.], seq 5797:5841, ack 11632, win 2523, options [nop,nop,TS val 3504506409 ecr 3038168444], length 44
04:04:04.115927 IP ip-172-31-72-201.ec2.internal.ssh > ec2-35-172-155-192.compute-1.amazonaws.com.59244: Flags [P.], seq 11632:13296, ack 5841, win 6376, options [nop,nop,TS val 3038168446 ecr 3504506407], length 1664
04:04:04.115943 IP ec2-35-172-155-192.compute-1.amazonaws.com.59244 > ip-172-31-72-201.ec2.internal.ssh: Flags [P.], seq 5841:5973, ack 11632, win 2523, options [nop,nop,TS val 3504506409 ecr 3038168444], length 132
